smartctl 6.5 2016-05-07 r4318 [x86_64-linux-4.7.9-200.fc24.x86_64] (local build)
Copyright (C) 2002-16, Bruce Allen, Christian Franke, www.smartmontools.org

=== START OF INFORMATION SECTION ===
Device Model:     TOSHIBA HDWE160
Serial Number:    26P9K3DGF56D
LU WWN Device Id: 5 000039 6dbb01f63
Firmware Version: FS2A
User Capacity:    6,001,175,126,016 bytes [6.00 TB]
Sector Sizes:     512 bytes logical, 4096 bytes physical
Rotation Rate:    7200 rpm
Form Factor:      3.5 inches
Device is:        Not in smartctl database [for details use: -P showall]
ATA Version is:   ATA8-ACS (minor revision not indicated)
SATA Version is:  SATA 3.0, 6.0 Gb/s (current: 3.0 Gb/s)
Local Time is:    Fri Jan 20 14:05:26 2017 +05
SMART support is: Available - device has SMART capability.
SMART support is: Enabled
AAM feature is:   Unavailable
APM level is:     128 (minimum power consumption without standby)
Rd look-ahead is: Enabled
Write cache is:   Enabled
ATA Security is:  Disabled, frozen [SEC2]
Wt Cache Reorder: Enabled

=== START OF READ SMART DATA SECTION ===
SMART overall-health self-assessment test result: PASSED

General SMART Values:
Offline data collection status:  (0x82)	Offline data collection activity
					was completed without error.
					Auto Offline Data Collection: Enabled.
Self-test execution status:      (   0)	The previous self-test routine completed
					without error or no self-test has ever 
					been run.
Total time to complete Offline 
data collection: 		(  120) seconds.
Offline data collection
capabilities: 			 (0x5b) SMART execute Offline immediate.
					Auto Offline data collection on/off support.
					Suspend Offline collection upon new
					command.
					Offline surface scan supported.
					Self-test supported.
					No Conveyance Self-test supported.
					Selective Self-test supported.
SMART capabilities:            (0x0003)	Saves SMART data before entering
					power-saving mode.
					Supports SMART auto save timer.
Error logging capability:        (0x01)	Error logging supported.
					General Purpose Logging supported.
Short self-test routine 
recommended polling time: 	 (   2) minutes.
Extended self-test routine
recommended polling time: 	 ( 630) minutes.
SCT capabilities: 	       (0x003d)	SCT Status supported.
					SCT Error Recovery Control supported.
					SCT Feature Control supported.
					SCT Data Table supported.

SMART Attributes Data Structure revision number: 16
Vendor Specific SMART Attributes with Thresholds:
ID# ATTRIBUTE_NAME          FLAGS    VALUE WORST THRESH FAIL RAW_VALUE
  1 Raw_Read_Error_Rate     PO-R--   100   100   050    -    0
  2 Throughput_Performance  P-S---   100   100   050    -    0
  3 Spin_Up_Time            POS--K   100   100   001    -    2530
  4 Start_Stop_Count        -O--CK   100   100   000    -    24
  5 Reallocated_Sector_Ct   PO--CK   100   100   050    -    0
  7 Seek_Error_Rate         PO-R--   100   100   050    -    0
  8 Seek_Time_Performance   P-S---   100   100   050    -    0
  9 Power_On_Hours          -O--CK   091   091   000    -    3816
 10 Spin_Retry_Count        PO--CK   100   100   030    -    0
 12 Power_Cycle_Count       -O--CK   100   100   000    -    24
191 G-Sense_Error_Rate      -O--CK   100   100   000    -    5
192 Power-Off_Retract_Count -O--CK   100   100   000    -    15
193 Load_Cycle_Count        -O--CK   100   100   000    -    66
194 Temperature_Celsius     -O---K   100   100   000    -    41 (Min/Max 23/52)
196 Reallocated_Event_Count -O--CK   100   100   000    -    0
197 Current_Pending_Sector  -O--CK   100   100   000    -    0
198 Offline_Uncorrectable   ----CK   100   100   000    -    0
199 UDMA_CRC_Error_Count    -O--CK   200   200   000    -    0
220 Disk_Shift              -O----   100   100   000    -    0
222 Loaded_Hours            -O--CK   091   091   000    -    3809
223 Load_Retry_Count        -O--CK   100   100   000    -    0
224 Load_Friction           -O---K   100   100   000    -    0
226 Load-in_Time            -OS--K   100   100   000    -    291
240 Head_Flying_Hours       P-----   100   100   001    -    0
                            ||||||_ K auto-keep
                            |||||__ C event count
                            ||||___ R error rate
                            |||____ S speed/performance
                            ||_____ O updated online
                            |______ P prefailure warning

General Purpose Log Directory Version 1
SMART           Log Directory Version 1 [multi-sector log support]
Address    Access  R/W   Size  Description
0x00       GPL,SL  R/O      1  Log Directory
0x01           SL  R/O      1  Summary SMART error log
0x02           SL  R/O     51  Comprehensive SMART error log
0x03       GPL     R/O     64  Ext. Comprehensive SMART error log
0x04       GPL,SL  R/O      8  Device Statistics log
0x06           SL  R/O      1  SMART self-test log
0x07       GPL     R/O      1  Extended self-test log
0x08       GPL     R/O      2  Power Conditions log
0x09           SL  R/W      1  Selective self-test log
0x0c       GPL     R/O   2048  Pending Defects log
0x10       GPL     R/O      1  SATA NCQ Queued Error log
0x11       GPL     R/O      1  SATA Phy Event Counters log
0x24       GPL     R/O  12288  Current Device Internal Status Data log
0x30       GPL,SL  R/O      9  IDENTIFY DEVICE data log
0x80-0x9f  GPL,SL  R/W     16  Host vendor specific log
0xa7       GPL     VS       8  Device vendor specific log
0xe0       GPL,SL  R/W      1  SCT Command/Status
0xe1       GPL,SL  R/W      1  SCT Data Transfer

SMART Extended Comprehensive Error Log Version: 1 (64 sectors)
No Errors Logged

SMART Extended Self-test Log Version: 1 (1 sectors)
No self-tests have been logged.  [To run self-tests, use: smartctl -t]

SMART Selective self-test log data structure revision number 1
 SPAN  MIN_LBA  MAX_LBA  CURRENT_TEST_STATUS
    1        0        0  Not_testing
    2        0        0  Not_testing
    3        0        0  Not_testing
    4        0        0  Not_testing
    5        0        0  Not_testing
Selective self-test flags (0x0):
  After scanning selected spans, do NOT read-scan remainder of disk.
If Selective self-test is pending on power-up, resume after 0 minute delay.

SCT Status Version:                  3
SCT Version (vendor specific):       1 (0x0001)
SCT Support Level:                   1
Device State:                        Active (0)
Current Temperature:                    41 Celsius
Power Cycle Min/Max Temperature:     36/43 Celsius
Lifetime    Min/Max Temperature:     23/52 Celsius
Under/Over Temperature Limit Count:   0/0

SCT Temperature History Version:     2
Temperature Sampling Period:         1 minute
Temperature Logging Interval:        1 minute
Min/Max recommended Temperature:      5/55 Celsius
Min/Max Temperature Limit:            5/55 Celsius
Temperature History Size (Index):    478 (79)

Index    Estimated Time   Temperature Celsius
  80    2017-01-20 06:08    40  *********************
 ...    ..( 18 skipped).    ..  *********************
  99    2017-01-20 06:27    40  *********************
 100    2017-01-20 06:28    41  **********************
 101    2017-01-20 06:29    40  *********************
 ...    ..(  7 skipped).    ..  *********************
 109    2017-01-20 06:37    40  *********************
 110    2017-01-20 06:38    41  **********************
 111    2017-01-20 06:39    40  *********************
 ...    ..(  2 skipped).    ..  *********************
 114    2017-01-20 06:42    40  *********************
 115    2017-01-20 06:43    41  **********************
 116    2017-01-20 06:44    40  *********************
 ...    ..( 58 skipped).    ..  *********************
 175    2017-01-20 07:43    40  *********************
 176    2017-01-20 07:44    41  **********************
 177    2017-01-20 07:45    40  *********************
 ...    ..( 14 skipped).    ..  *********************
 192    2017-01-20 08:00    40  *********************
 193    2017-01-20 08:01    41  **********************
 194    2017-01-20 08:02    40  *********************
 195    2017-01-20 08:03    41  **********************
 ...    ..(  2 skipped).    ..  **********************
 198    2017-01-20 08:06    41  **********************
 199    2017-01-20 08:07    40  *********************
 ...    ..(  2 skipped).    ..  *********************
 202    2017-01-20 08:10    40  *********************
 203    2017-01-20 08:11    41  **********************
 204    2017-01-20 08:12    40  *********************
 205    2017-01-20 08:13    40  *********************
 206    2017-01-20 08:14    40  *********************
 207    2017-01-20 08:15    41  **********************
 208    2017-01-20 08:16    41  **********************
 209    2017-01-20 08:17    41  **********************
 210    2017-01-20 08:18    40  *********************
 211    2017-01-20 08:19    41  **********************
 212    2017-01-20 08:20    41  **********************
 213    2017-01-20 08:21    41  **********************
 214    2017-01-20 08:22    40  *********************
 215    2017-01-20 08:23    41  **********************
 216    2017-01-20 08:24    41  **********************
 217    2017-01-20 08:25    41  **********************
 218    2017-01-20 08:26    40  *********************
 219    2017-01-20 08:27    41  **********************
 ...    ..(  2 skipped).    ..  **********************
 222    2017-01-20 08:30    41  **********************
 223    2017-01-20 08:31    40  *********************
 ...    ..( 23 skipped).    ..  *********************
 247    2017-01-20 08:55    40  *********************
 248    2017-01-20 08:56    41  **********************
 249    2017-01-20 08:57    40  *********************
 ...    ..(213 skipped).    ..  *********************
 463    2017-01-20 12:31    40  *********************
 464    2017-01-20 12:32    41  **********************
 465    2017-01-20 12:33    40  *********************
 ...    ..(  8 skipped).    ..  *********************
 474    2017-01-20 12:42    40  *********************
 475    2017-01-20 12:43    41  **********************
 476    2017-01-20 12:44    41  **********************
 477    2017-01-20 12:45    40  *********************
 ...    ..(  3 skipped).    ..  *********************
   3    2017-01-20 12:49    40  *********************
   4    2017-01-20 12:50    41  **********************
   5    2017-01-20 12:51    40  *********************
 ...    ..(  8 skipped).    ..  *********************
  14    2017-01-20 13:00    40  *********************
  15    2017-01-20 13:01    41  **********************
  16    2017-01-20 13:02    41  **********************
  17    2017-01-20 13:03    40  *********************
  18    2017-01-20 13:04    41  **********************
 ...    ..(  2 skipped).    ..  **********************
  21    2017-01-20 13:07    41  **********************
  22    2017-01-20 13:08    40  *********************
  23    2017-01-20 13:09    41  **********************
 ...    ..(  3 skipped).    ..  **********************
  27    2017-01-20 13:13    41  **********************
  28    2017-01-20 13:14    40  *********************
  29    2017-01-20 13:15    41  **********************
 ...    ..( 49 skipped).    ..  **********************
  79    2017-01-20 14:05    41  **********************

SCT Error Recovery Control:
           Read: Disabled
          Write: Disabled

Device Statistics (GP Log 0x04)
Page  Offset Size        Value Flags Description
0x01  =====  =               =  ===  == General Statistics (rev 2) ==
0x01  0x008  4              24  ---  Lifetime Power-On Resets
0x01  0x010  4            3816  ---  Power-on Hours
0x01  0x018  6      9196220012  ---  Logical Sectors Written
0x01  0x020  6       247522874  ---  Number of Write Commands
0x01  0x028  6    271254476832  ---  Logical Sectors Read
0x01  0x030  6       278733796  ---  Number of Read Commands
0x02  =====  =               =  ===  == Free-Fall Statistics (rev 1) ==
0x02  0x010  4               5  ---  Overlimit Shock Events
0x03  =====  =               =  ===  == Rotating Media Statistics (rev 1) ==
0x03  0x008  4            3816  ---  Spindle Motor Power-on Hours
0x03  0x010  4            3809  ---  Head Flying Hours
0x03  0x018  4              66  ---  Head Load Events
0x03  0x020  4               0  ---  Number of Reallocated Logical Sectors
0x03  0x028  4               0  ---  Read Recovery Attempts
0x03  0x030  4               0  ---  Number of Mechanical Start Failures
0x04  =====  =               =  ===  == General Errors Statistics (rev 1) ==
0x04  0x008  4               0  ---  Number of Reported Uncorrectable Errors
0x04  0x010  4               0  ---  Resets Between Cmd Acceptance and Completion
0x05  =====  =               =  ===  == Temperature Statistics (rev 1) ==
0x05  0x008  1              41  ---  Current Temperature
0x05  0x010  1              40  N--  Average Short Term Temperature
0x05  0x018  1              38  N--  Average Long Term Temperature
0x05  0x020  1              52  ---  Highest Temperature
0x05  0x028  1              23  ---  Lowest Temperature
0x05  0x030  1              47  N--  Highest Average Short Term Temperature
0x05  0x038  1              36  N--  Lowest Average Short Term Temperature
0x05  0x040  1              40  N--  Highest Average Long Term Temperature
0x05  0x048  1              37  N--  Lowest Average Long Term Temperature
0x05  0x050  4               0  ---  Time in Over-Temperature
0x05  0x058  1              55  ---  Specified Maximum Operating Temperature
0x05  0x060  4               0  ---  Time in Under-Temperature
0x05  0x068  1               5  ---  Specified Minimum Operating Temperature
0x06  =====  =               =  ===  == Transport Statistics (rev 1) ==
0x06  0x008  4             212  ---  Number of Hardware Resets
0x06  0x018  4               0  ---  Number of Interface CRC Errors
0x07  =====  =               =  ===  == Solid State Device Statistics (rev 1) ==
                                |||_ C monitored condition met
                                ||__ D supports DSN
                                |___ N normalized value

SATA Phy Event Counters (GP Log 0x11)
ID      Size     Value  Description
0x0001  4            0  Command failed due to ICRC error
0x0002  4            0  R_ERR response for data FIS
0x0003  4            0  R_ERR response for device-to-host data FIS
0x0004  4            0  R_ERR response for host-to-device data FIS
0x0005  4            0  R_ERR response for non-data FIS
0x0006  4            0  R_ERR response for device-to-host non-data FIS
0x0007  4            0  R_ERR response for host-to-device non-data FIS
0x0008  4            0  Device-to-host non-data FIS retries
0x0009  4            3  Transition from drive PhyRdy to drive PhyNRdy
0x000a  4            3  Device-to-host register FISes sent due to a COMRESET
0x000b  4            0  CRC errors within host-to-device FIS
0x000d  4            0  Non-CRC errors within host-to-device FIS
0x000f  4            0  R_ERR response for host-to-device data FIS, CRC
0x0010  4            0  R_ERR response for host-to-device data FIS, non-CRC
0x0012  4            0  R_ERR response for host-to-device non-data FIS, CRC
0x0013  4            0  R_ERR response for host-to-device non-data FIS, non-CRC
