smartctl 6.5 2016-05-07 r4318 [x86_64-linux-4.8.6-300.fc25.x86_64] (local build)
Copyright (C) 2002-16, Bruce Allen, Christian Franke, www.smartmontools.org

=== START OF INFORMATION SECTION ===
Model Family:     Western Digital Caviar Black
Device Model:     WDC WD5001AALS-00J7B0
Serial Number:    WD-WMATV8687841
LU WWN Device Id: 5 0014ee 057c68e58
Firmware Version: 05.00K05
User Capacity:    500,107,862,016 bytes [500 GB]
Sector Size:      512 bytes logical/physical
Device is:        In smartctl database [for details use: -P show]
ATA Version is:   ATA8-ACS (minor revision not indicated)
SATA Version is:  SATA 2.5, 3.0 Gb/s
Local Time is:    Tue Jan 24 16:32:39 2017 +05
SMART support is: Available - device has SMART capability.
SMART support is: Enabled
AAM feature is:   Disabled
APM feature is:   Unavailable
Rd look-ahead is: Enabled
Write cache is:   Enabled
ATA Security is:  Disabled, NOT FROZEN [SEC1]
Wt Cache Reorder: Enabled

=== START OF READ SMART DATA SECTION ===
SMART overall-health self-assessment test result: PASSED

General SMART Values:
Offline data collection status:  (0x82)	Offline data collection activity
					was completed without error.
					Auto Offline Data Collection: Enabled.
Self-test execution status:      (   0)	The previous self-test routine completed
					without error or no self-test has ever 
					been run.
Total time to complete Offline 
data collection: 		(11160) seconds.
Offline data collection
capabilities: 			 (0x7b) SMART execute Offline immediate.
					Auto Offline data collection on/off support.
					Suspend Offline collection upon new
					command.
					Offline surface scan supported.
					Self-test supported.
					Conveyance Self-test supported.
					Selective Self-test supported.
SMART capabilities:            (0x0003)	Saves SMART data before entering
					power-saving mode.
					Supports SMART auto save timer.
Error logging capability:        (0x01)	Error logging supported.
					General Purpose Logging supported.
Short self-test routine 
recommended polling time: 	 (   2) minutes.
Extended self-test routine
recommended polling time: 	 ( 131) minutes.
Conveyance self-test routine
recommended polling time: 	 (   5) minutes.
SCT capabilities: 	       (0x3037)	SCT Status supported.
					SCT Feature Control supported.
					SCT Data Table supported.

SMART Attributes Data Structure revision number: 16
Vendor Specific SMART Attributes with Thresholds:
ID# ATTRIBUTE_NAME          FLAGS    VALUE WORST THRESH FAIL RAW_VALUE
  1 Raw_Read_Error_Rate     POSR-K   200   200   051    -    0
  3 Spin_Up_Time            POS--K   239   233   021    -    8033
  4 Start_Stop_Count        -O--CK   100   100   000    -    199
  5 Reallocated_Sector_Ct   PO--CK   200   200   140    -    0
  7 Seek_Error_Rate         -OSR-K   200   200   000    -    0
  9 Power_On_Hours          -O--CK   027   027   000    -    53543
 10 Spin_Retry_Count        -O--CK   100   100   000    -    0
 11 Calibration_Retry_Count -O--CK   100   100   000    -    0
 12 Power_Cycle_Count       -O--CK   100   100   000    -    197
192 Power-Off_Retract_Count -O--CK   200   200   000    -    193
193 Load_Cycle_Count        -O--CK   200   200   000    -    199
194 Temperature_Celsius     -O---K   113   098   000    -    37
196 Reallocated_Event_Count -O--CK   200   200   000    -    0
197 Current_Pending_Sector  -O--CK   200   200   000    -    0
198 Offline_Uncorrectable   ----CK   200   200   000    -    0
199 UDMA_CRC_Error_Count    -O--CK   200   200   000    -    0
200 Multi_Zone_Error_Rate   ---R--   200   200   000    -    0
                            ||||||_ K auto-keep
                            |||||__ C event count
                            ||||___ R error rate
                            |||____ S speed/performance
                            ||_____ O updated online
                            |______ P prefailure warning

General Purpose Log Directory Version 1
SMART           Log Directory Version 1 [multi-sector log support]
Address    Access  R/W   Size  Description
0x00       GPL,SL  R/O      1  Log Directory
0x01           SL  R/O      1  Summary SMART error log
0x02           SL  R/O      5  Comprehensive SMART error log
0x03       GPL     R/O      6  Ext. Comprehensive SMART error log
0x06           SL  R/O      1  SMART self-test log
0x07       GPL     R/O      1  Extended self-test log
0x09           SL  R/W      1  Selective self-test log
0x10       GPL     R/O      1  SATA NCQ Queued Error log
0x11       GPL     R/O      1  SATA Phy Event Counters log
0x80-0x9f  GPL,SL  R/W     16  Host vendor specific log
0xa0-0xa7  GPL,SL  VS      16  Device vendor specific log
0xa8-0xb7  GPL,SL  VS       1  Device vendor specific log
0xbd       GPL,SL  VS       1  Device vendor specific log
0xc0       GPL,SL  VS       1  Device vendor specific log
0xc1       GPL     VS      24  Device vendor specific log
0xe0       GPL,SL  R/W      1  SCT Command/Status
0xe1       GPL,SL  R/W      1  SCT Data Transfer

SMART Extended Comprehensive Error Log Version: 1 (6 sectors)
No Errors Logged

SMART Extended Self-test Log Version: 1 (1 sectors)
No self-tests have been logged.  [To run self-tests, use: smartctl -t]

SMART Selective self-test log data structure revision number 1
 SPAN  MIN_LBA  MAX_LBA  CURRENT_TEST_STATUS
    1        0        0  Not_testing
    2        0        0  Not_testing
    3        0        0  Not_testing
    4        0        0  Not_testing
    5        0        0  Not_testing
Selective self-test flags (0x0):
  After scanning selected spans, do NOT read-scan remainder of disk.
If Selective self-test is pending on power-up, resume after 0 minute delay.

SCT Status Version:                  2
SCT Version (vendor specific):       258 (0x0102)
SCT Support Level:                   1
Device State:                        Active (0)
Current Temperature:                    37 Celsius
Power Cycle Min/Max Temperature:     35/37 Celsius
Lifetime    Min/Max Temperature:      ?/52 Celsius
Under/Over Temperature Limit Count:   0/0

SCT Temperature History Version:     2
Temperature Sampling Period:         1 minute
Temperature Logging Interval:        1 minute
Min/Max recommended Temperature:      0/60 Celsius
Min/Max Temperature Limit:           -41/85 Celsius
Temperature History Size (Index):    128 (35)

Index    Estimated Time   Temperature Celsius
  36    2017-01-24 14:25     ?  -
  37    2017-01-24 14:26    27  ********
  38    2017-01-24 14:27    27  ********
  39    2017-01-24 14:28    28  *********
  40    2017-01-24 14:29    29  **********
  41    2017-01-24 14:30    29  **********
  42    2017-01-24 14:31    30  ***********
  43    2017-01-24 14:32     ?  -
  44    2017-01-24 14:33    27  ********
  45    2017-01-24 14:34    28  *********
  46    2017-01-24 14:35    29  **********
  47    2017-01-24 14:36    29  **********
  48    2017-01-24 14:37    30  ***********
  49    2017-01-24 14:38    30  ***********
  50    2017-01-24 14:39    30  ***********
  51    2017-01-24 14:40    31  ************
  52    2017-01-24 14:41    31  ************
  53    2017-01-24 14:42    32  *************
  54    2017-01-24 14:43    32  *************
  55    2017-01-24 14:44    33  **************
  56    2017-01-24 14:45    33  **************
  57    2017-01-24 14:46    33  **************
  58    2017-01-24 14:47    34  ***************
 ...    ..(  7 skipped).    ..  ***************
  66    2017-01-24 14:55    34  ***************
  67    2017-01-24 14:56     ?  -
  68    2017-01-24 14:57    35  ****************
 ...    ..(  9 skipped).    ..  ****************
  78    2017-01-24 15:07    35  ****************
  79    2017-01-24 15:08     ?  -
  80    2017-01-24 15:09    35  ****************
 ...    ..(  6 skipped).    ..  ****************
  87    2017-01-24 15:16    35  ****************
  88    2017-01-24 15:17    36  *****************
  89    2017-01-24 15:18    36  *****************
  90    2017-01-24 15:19    35  ****************
  91    2017-01-24 15:20    36  *****************
  92    2017-01-24 15:21    36  *****************
  93    2017-01-24 15:22    36  *****************
  94    2017-01-24 15:23    37  ******************
  95    2017-01-24 15:24    36  *****************
  96    2017-01-24 15:25    36  *****************
  97    2017-01-24 15:26    37  ******************
  98    2017-01-24 15:27    36  *****************
  99    2017-01-24 15:28    36  *****************
 100    2017-01-24 15:29    37  ******************
 ...    ..( 43 skipped).    ..  ******************
  16    2017-01-24 16:13    37  ******************
  17    2017-01-24 16:14     ?  -
  18    2017-01-24 16:15    35  ****************
 ...    ..(  5 skipped).    ..  ****************
  24    2017-01-24 16:21    35  ****************
  25    2017-01-24 16:22    36  *****************
 ...    ..(  5 skipped).    ..  *****************
  31    2017-01-24 16:28    36  *****************
  32    2017-01-24 16:29    37  ******************
 ...    ..(  2 skipped).    ..  ******************
  35    2017-01-24 16:32    37  ******************

SCT Error Recovery Control command not supported

Device Statistics (GP/SMART Log 0x04) not supported

SATA Phy Event Counters (GP Log 0x11)
ID      Size     Value  Description
0x0001  2            0  Command failed due to ICRC error
0x0002  2            0  R_ERR response for data FIS
0x0003  2            0  R_ERR response for device-to-host data FIS
0x0004  2            0  R_ERR response for host-to-device data FIS
0x0005  2            0  R_ERR response for non-data FIS
0x0006  2            0  R_ERR response for device-to-host non-data FIS
0x0007  2            0  R_ERR response for host-to-device non-data FIS
0x000a  2           10  Device-to-host register FISes sent due to a COMRESET
0x8000  4         1101  Vendor specific

